{
  "$schema": "../schemas/extraction-schemas.schema.json",
  "pack": {
    "id": "pack.extraction-schemas.phase1",
    "version": "0.1.0-draft",
    "label": "Phase 1 extraction and evidence seed",
    "description": "Disabled synthetic field, anchor, evidence-role, and extraction-schema definitions with no provider or calibration selection.",
    "meta_ref": "meta.product-draft",
    "retirement": {"state": "ACTIVE_DRAFT", "supersedes_ref": null, "replacement_ref": null, "retired_at": null},
    "decision_refs": ["DEC-035", "DEC-036"],
    "contract_refs": ["DIT-EXT-001", "AI-OUT-001", "ARCH-DATA-001"],
    "attributes": {"runtime_enabled": false, "provider_selected": false, "calibration_selected": false}
  },
  "field_types": [
    {"id": "field-type.string", "version": "0.1.0-draft", "label": "String field", "description": "Provider-neutral string field type.", "meta_ref": "meta.reference-data-draft", "retirement": {"state": "ACTIVE_DRAFT", "supersedes_ref": null, "replacement_ref": null, "retired_at": null}, "decision_refs": ["DEC-035"], "contract_refs": ["DIT-EXT-P1-003"], "attributes": {"wire_type": "STRING", "runtime_enabled": false}},
    {"id": "field-type.local-date", "version": "0.1.0-draft", "label": "Local date field", "description": "Date without fabricated timezone or time-of-day precision.", "meta_ref": "meta.reference-data-draft", "retirement": {"state": "ACTIVE_DRAFT", "supersedes_ref": null, "replacement_ref": null, "retired_at": null}, "decision_refs": ["DEC-035"], "contract_refs": ["DIT-EXT-P1-004"], "attributes": {"wire_type": "LOCAL_DATE", "runtime_enabled": false}},
    {"id": "field-type.opaque-identifier", "version": "0.1.0-draft", "label": "Opaque identifier field", "description": "Identifier value whose issuer and normalization remain evidence-bound.", "meta_ref": "meta.reference-data-draft", "retirement": {"state": "ACTIVE_DRAFT", "supersedes_ref": null, "replacement_ref": null, "retired_at": null}, "decision_refs": ["DEC-035"], "contract_refs": ["DIT-EXT-P1-003"], "attributes": {"wire_type": "OPAQUE_IDENTIFIER", "runtime_enabled": false}}
  ],
  "evidence_anchor_types": [
    {"id": "anchor-type.TEXT_SPAN", "version": "0.1.0-draft", "label": "Text span", "description": "Exact character/token span in an immutable representation.", "meta_ref": "meta.reference-data-draft", "retirement": {"state": "ACTIVE_DRAFT", "supersedes_ref": null, "replacement_ref": null, "retired_at": null}, "decision_refs": [], "contract_refs": ["DIT-EXT-P1-009"], "attributes": {"code": "TEXT_SPAN", "location_fields": ["representation_ref", "start", "end", "integrity_digest"], "runtime_enabled": false}},
    {"id": "anchor-type.PAGE_REGION", "version": "0.1.0-draft", "label": "Page region", "description": "Bounded coordinates on an exact page and representation.", "meta_ref": "meta.reference-data-draft", "retirement": {"state": "ACTIVE_DRAFT", "supersedes_ref": null, "replacement_ref": null, "retired_at": null}, "decision_refs": [], "contract_refs": ["DIT-EXT-P1-009"], "attributes": {"code": "PAGE_REGION", "location_fields": ["representation_ref", "page", "coordinate_system", "coordinates", "integrity_digest"], "runtime_enabled": false}},
    {"id": "anchor-type.POLYGON", "version": "0.1.0-draft", "label": "Polygon region", "description": "Ordered polygon coordinates on an exact representation.", "meta_ref": "meta.reference-data-draft", "retirement": {"state": "ACTIVE_DRAFT", "supersedes_ref": null, "replacement_ref": null, "retired_at": null}, "decision_refs": [], "contract_refs": ["DIT-EXT-P1-009"], "attributes": {"code": "POLYGON", "location_fields": ["representation_ref", "page", "coordinate_system", "points", "integrity_digest"], "runtime_enabled": false}},
    {"id": "anchor-type.TABLE_CELL", "version": "0.1.0-draft", "label": "Table cell", "description": "Structural table and cell address with exact representation lineage.", "meta_ref": "meta.reference-data-draft", "retirement": {"state": "ACTIVE_DRAFT", "supersedes_ref": null, "replacement_ref": null, "retired_at": null}, "decision_refs": [], "contract_refs": ["DIT-EXT-P1-009"], "attributes": {"code": "TABLE_CELL", "location_fields": ["representation_ref", "table", "row", "column", "integrity_digest"], "runtime_enabled": false}}
  ],
  "support_roles": [
    {"id": "support-role.DIRECT", "version": "0.1.0-draft", "label": "Direct evidence", "description": "Evidence directly supporting the asserted value or claim.", "meta_ref": "meta.reference-data-draft", "retirement": {"state": "ACTIVE_DRAFT", "supersedes_ref": null, "replacement_ref": null, "retired_at": null}, "decision_refs": [], "contract_refs": ["DIT-EXT-P1-011"], "attributes": {"code": "DIRECT", "runtime_enabled": false}},
    {"id": "support-role.CONTEXT", "version": "0.1.0-draft", "label": "Context evidence", "description": "Evidence providing context without independently supporting the asserted value.", "meta_ref": "meta.reference-data-draft", "retirement": {"state": "ACTIVE_DRAFT", "supersedes_ref": null, "replacement_ref": null, "retired_at": null}, "decision_refs": [], "contract_refs": ["DIT-EXT-P1-011"], "attributes": {"code": "CONTEXT", "runtime_enabled": false}},
    {"id": "support-role.QUALIFIER", "version": "0.1.0-draft", "label": "Qualifying evidence", "description": "Evidence qualifying scope, meaning, or temporal interpretation.", "meta_ref": "meta.reference-data-draft", "retirement": {"state": "ACTIVE_DRAFT", "supersedes_ref": null, "replacement_ref": null, "retired_at": null}, "decision_refs": [], "contract_refs": ["DIT-EXT-P1-011"], "attributes": {"code": "QUALIFIER", "runtime_enabled": false}},
    {"id": "support-role.CONTRADICTORY", "version": "0.1.0-draft", "label": "Contradictory evidence", "description": "Evidence that contradicts rather than supports the asserted value.", "meta_ref": "meta.reference-data-draft", "retirement": {"state": "ACTIVE_DRAFT", "supersedes_ref": null, "replacement_ref": null, "retired_at": null}, "decision_refs": [], "contract_refs": ["DIT-EXT-P1-011"], "attributes": {"code": "CONTRADICTORY", "runtime_enabled": false}}
  ],
  "evidence_fields": [
    {"id": "evidence-field.generic-policy.reference", "version": "0.1.0-draft", "label": "Synthetic record reference", "description": "Opaque reference proposed from the synthetic generic record.", "meta_ref": "meta.product-draft", "retirement": {"state": "ACTIVE_DRAFT", "supersedes_ref": null, "replacement_ref": null, "retired_at": null}, "decision_refs": ["DEC-035"], "contract_refs": ["DIT-EXT-P1-003", "DIT-EXT-P1-008"], "attributes": {"field_type_ref": "field-type.opaque-identifier", "cardinality": "ZERO_OR_ONE", "sensitivity_ref": "privacy.P3-SENSITIVE", "material": true, "anchor_type_refs": ["anchor-type.TEXT_SPAN", "anchor-type.PAGE_REGION"], "support_role_refs": ["support-role.DIRECT", "support-role.QUALIFIER", "support-role.CONTRADICTORY"], "presence_state_refs": ["state.presence.ABSENT_NOT_FOUND", "state.presence.AMBIGUOUS", "state.presence.RESTRICTED_NOT_PROCESSED", "state.presence.UNAVAILABLE"], "runtime_enabled": false}},
    {"id": "evidence-field.generic-policy.party-name", "version": "0.1.0-draft", "label": "Synthetic party name", "description": "Protected party-name proposal; it is not a resolved person or organisation identity.", "meta_ref": "meta.product-draft", "retirement": {"state": "ACTIVE_DRAFT", "supersedes_ref": null, "replacement_ref": null, "retired_at": null}, "decision_refs": ["DEC-035"], "contract_refs": ["DIT-EXT-P1-006", "DIT-FCT-P1-027"], "attributes": {"field_type_ref": "field-type.string", "cardinality": "ZERO_OR_MANY", "sensitivity_ref": "privacy.P4-RESTRICTED", "material": true, "anchor_type_refs": ["anchor-type.TEXT_SPAN", "anchor-type.PAGE_REGION", "anchor-type.TABLE_CELL"], "support_role_refs": ["support-role.DIRECT", "support-role.CONTEXT", "support-role.CONTRADICTORY"], "presence_state_refs": ["state.presence.ABSENT_NOT_FOUND", "state.presence.AMBIGUOUS", "state.presence.RESTRICTED_NOT_PROCESSED", "state.presence.UNAVAILABLE"], "runtime_enabled": false}},
    {"id": "evidence-field.generic-policy.effective-from", "version": "0.1.0-draft", "label": "Synthetic effective-from date", "description": "Local-date proposal retaining source precision and evidence.", "meta_ref": "meta.product-draft", "retirement": {"state": "ACTIVE_DRAFT", "supersedes_ref": null, "replacement_ref": null, "retired_at": null}, "decision_refs": ["DEC-035"], "contract_refs": ["DIT-EXT-P1-004", "DIT-EXT-P1-008"], "attributes": {"field_type_ref": "field-type.local-date", "cardinality": "ZERO_OR_ONE", "sensitivity_ref": "privacy.P3-SENSITIVE", "material": true, "anchor_type_refs": ["anchor-type.TEXT_SPAN", "anchor-type.PAGE_REGION", "anchor-type.TABLE_CELL"], "support_role_refs": ["support-role.DIRECT", "support-role.QUALIFIER", "support-role.CONTRADICTORY"], "presence_state_refs": ["state.presence.ABSENT_NOT_FOUND", "state.presence.AMBIGUOUS", "state.presence.UNREADABLE", "state.presence.RESTRICTED_NOT_PROCESSED", "state.presence.UNAVAILABLE"], "runtime_enabled": false}},